{
  "score": 39.5,
  "level": "MALICIOUS",
  "whitelisted": false,
  "whitelists": [],
  "observables": {
    "obs:file:input-data": {
      "key": "obs:file:input-data",
      "type": "file",
      "value": "input-data",
      "internal": false,
      "whitelisted": false,
      "comment": "Root observable for investigation",
      "extra": null,
      "score": 0.0,
      "level": "INFO",
      "relationships": [
        {
          "target_key": "obs:email-message:phishing email - invoice #12345",
          "relationship_type": "related-to",
          "direction": "bidirectional"
        },
        {
          "target_key": "obs:domain-name:sketchy-site.net",
          "relationship_type": "related-to",
          "direction": "bidirectional"
        },
        {
          "target_key": "obs:domain-name:google.com",
          "relationship_type": "related-to",
          "direction": "bidirectional"
        },
        {
          "target_key": "obs:domain-name:new-service.cloud",
          "relationship_type": "related-to",
          "direction": "bidirectional"
        }
      ],
      "threat_intels": [],
      "generated_by_checks": []
    },
    "obs:domain-name:evil-phishing.com": {
      "key": "obs:domain-name:evil-phishing.com",
      "type": "domain-name",
      "value": "evil-phishing.com",
      "internal": false,
      "whitelisted": false,
      "comment": "",
      "extra": {},
      "score": 9.0,
      "level": "MALICIOUS",
      "relationships": [],
      "threat_intels": [
        "ti:virustotal:obs:domain-name:evil-phishing.com",
        "ti:alienvault otx:obs:domain-name:evil-phishing.com"
      ],
      "generated_by_checks": [
        "chk:infrastructure:network"
      ]
    },
    "obs:ipv4-addr:185.220.101.50": {
      "key": "obs:ipv4-addr:185.220.101.50",
      "type": "ipv4-addr",
      "value": "185.220.101.50",
      "internal": false,
      "whitelisted": false,
      "comment": "",
      "extra": {},
      "score": 9.5,
      "level": "MALICIOUS",
      "relationships": [
        {
          "target_key": "obs:domain-name:evil-phishing.com",
          "relationship_type": "related-to",
          "direction": "outbound"
        }
      ],
      "threat_intels": [
        "ti:abuseipdb:obs:ipv4-addr:185.220.101.50"
      ],
      "generated_by_checks": [
        "chk:infrastructure:network"
      ]
    },
    "obs:domain-name:sketchy-site.net": {
      "key": "obs:domain-name:sketchy-site.net",
      "type": "domain-name",
      "value": "sketchy-site.net",
      "internal": false,
      "whitelisted": false,
      "comment": "",
      "extra": {},
      "score": 4.5,
      "level": "SUSPICIOUS",
      "relationships": [
        {
          "target_key": "obs:ipv4-addr:192.168.100.5",
          "relationship_type": "related-to",
          "direction": "outbound"
        }
      ],
      "threat_intels": [
        "ti:virustotal:obs:domain-name:sketchy-site.net"
      ],
      "generated_by_checks": []
    },
    "obs:ipv4-addr:192.168.100.5": {
      "key": "obs:ipv4-addr:192.168.100.5",
      "type": "ipv4-addr",
      "value": "192.168.100.5",
      "internal": false,
      "whitelisted": false,
      "comment": "",
      "extra": {},
      "score": 3.0,
      "level": "SUSPICIOUS",
      "relationships": [],
      "threat_intels": [
        "ti:shodan:obs:ipv4-addr:192.168.100.5"
      ],
      "generated_by_checks": []
    },
    "obs:email-addr:attacker@evil-phishing.com": {
      "key": "obs:email-addr:attacker@evil-phishing.com",
      "type": "email-addr",
      "value": "attacker@evil-phishing.com",
      "internal": false,
      "whitelisted": false,
      "comment": "",
      "extra": {},
      "score": 8.0,
      "level": "MALICIOUS",
      "relationships": [
        {
          "target_key": "obs:domain-name:evil-phishing.com",
          "relationship_type": "related-to",
          "direction": "bidirectional"
        }
      ],
      "threat_intels": [
        "ti:emailrep:obs:email-addr:attacker@evil-phishing.com"
      ],
      "generated_by_checks": [
        "chk:email_analysis:email"
      ]
    },
    "obs:email-addr:victim@company.com": {
      "key": "obs:email-addr:victim@company.com",
      "type": "email-addr",
      "value": "victim@company.com",
      "internal": true,
      "whitelisted": false,
      "comment": "",
      "extra": {},
      "score": -1.0,
      "level": "TRUSTED",
      "relationships": [],
      "threat_intels": [
        "ti:internal whitelist:obs:email-addr:victim@company.com"
      ],
      "generated_by_checks": [
        "chk:email_analysis:email"
      ]
    },
    "obs:email-message:phishing email - invoice #12345": {
      "key": "obs:email-message:phishing email - invoice #12345",
      "type": "email-message",
      "value": "Phishing Email - Invoice #12345",
      "internal": false,
      "whitelisted": false,
      "comment": "",
      "extra": {},
      "score": 10.0,
      "level": "MALICIOUS",
      "relationships": [
        {
          "target_key": "obs:email-addr:attacker@evil-phishing.com",
          "relationship_type": "related-to",
          "direction": "outbound"
        },
        {
          "target_key": "obs:email-addr:victim@company.com",
          "relationship_type": "related-to",
          "direction": "outbound"
        },
        {
          "target_key": "obs:url:https://evil-phishing.com/login",
          "relationship_type": "related-to",
          "direction": "outbound"
        },
        {
          "target_key": "obs:url:https://evil-phishing.com/verify",
          "relationship_type": "related-to",
          "direction": "outbound"
        }
      ],
      "threat_intels": [
        "ti:email gateway:obs:email-message:phishing email - invoice #12345"
      ],
      "generated_by_checks": [
        "chk:email_analysis:email"
      ]
    },
    "obs:url:https://evil-phishing.com/login": {
      "key": "obs:url:https://evil-phishing.com/login",
      "type": "url",
      "value": "https://evil-phishing.com/login",
      "internal": false,
      "whitelisted": false,
      "comment": "",
      "extra": {},
      "score": 10.0,
      "level": "MALICIOUS",
      "relationships": [
        {
          "target_key": "obs:domain-name:evil-phishing.com",
          "relationship_type": "related-to",
          "direction": "outbound"
        }
      ],
      "threat_intels": [
        "ti:urlhaus:obs:url:https://evil-phishing.com/login"
      ],
      "generated_by_checks": [
        "chk:url_analysis:network"
      ]
    },
    "obs:url:https://evil-phishing.com/verify": {
      "key": "obs:url:https://evil-phishing.com/verify",
      "type": "url",
      "value": "https://evil-phishing.com/verify",
      "internal": false,
      "whitelisted": false,
      "comment": "",
      "extra": {},
      "score": 9.0,
      "level": "MALICIOUS",
      "relationships": [
        {
          "target_key": "obs:domain-name:evil-phishing.com",
          "relationship_type": "related-to",
          "direction": "outbound"
        }
      ],
      "threat_intels": [
        "ti:urlhaus:obs:url:https://evil-phishing.com/verify"
      ],
      "generated_by_checks": [
        "chk:url_analysis:network"
      ]
    },
    "obs:file:invoice.exe": {
      "key": "obs:file:invoice.exe",
      "type": "file",
      "value": "invoice.exe",
      "internal": false,
      "whitelisted": false,
      "comment": "",
      "extra": {},
      "score": 10.0,
      "level": "MALICIOUS",
      "relationships": [
        {
          "target_key": "obs:url:https://evil-phishing.com/login",
          "relationship_type": "related-to",
          "direction": "inbound"
        },
        {
          "target_key": "obs:ipv4-addr:185.220.101.50",
          "relationship_type": "related-to",
          "direction": "bidirectional"
        }
      ],
      "threat_intels": [
        "ti:virustotal:obs:file:invoice.exe"
      ],
      "generated_by_checks": [
        "chk:malware_detection:file"
      ]
    },
    "obs:domain-name:google.com": {
      "key": "obs:domain-name:google.com",
      "type": "domain-name",
      "value": "google.com",
      "internal": false,
      "whitelisted": true,
      "comment": "",
      "extra": {},
      "score": -2.0,
      "level": "TRUSTED",
      "relationships": [],
      "threat_intels": [
        "ti:internal whitelist:obs:domain-name:google.com"
      ],
      "generated_by_checks": []
    },
    "obs:domain-name:new-service.cloud": {
      "key": "obs:domain-name:new-service.cloud",
      "type": "domain-name",
      "value": "new-service.cloud",
      "internal": false,
      "whitelisted": false,
      "comment": "",
      "extra": {},
      "score": 2.0,
      "level": "NOTABLE",
      "relationships": [],
      "threat_intels": [
        "ti:passive dns:obs:domain-name:new-service.cloud"
      ],
      "generated_by_checks": []
    }
  },
  "checks": {
    "email": [
      {
        "key": "chk:email_analysis:email",
        "check_id": "email_analysis",
        "scope": "email",
        "description": "Phishing email analysis",
        "comment": "",
        "extra": {},
        "score": 10.0,
        "level": "MALICIOUS",
        "score_policy": "auto",
        "observables": [
          "obs:email-message:phishing email - invoice #12345",
          "obs:email-addr:attacker@evil-phishing.com",
          "obs:email-addr:victim@company.com"
        ]
      }
    ],
    "network": [
      {
        "key": "chk:url_analysis:network",
        "check_id": "url_analysis",
        "scope": "network",
        "description": "Malicious URLs found in email",
        "comment": "",
        "extra": {},
        "score": 10.0,
        "level": "MALICIOUS",
        "score_policy": "auto",
        "observables": [
          "obs:url:https://evil-phishing.com/login",
          "obs:url:https://evil-phishing.com/verify"
        ]
      },
      {
        "key": "chk:infrastructure:network",